16:09:32.632813 IP 128.178.1.196.62133 > 10.92.103.53.53: 53116+ A? d.dropbox.com. (31)
16:09:32.632833 IP 128.178.1.196.62919 > 10.92.103.53.53: 5268+ AAAA? d.dropbox.com. (31)
16:09:32.633165 IP 10.92.103.53.40756 > 128.178.15.7.53: 5268+ AAAA? d.dropbox.com. (31)
16:09:32.633343 IP 10.92.103.53.47809 > 128.178.15.7.53: 53116+ A? d.dropbox.com. (31)
16:09:32.634052 IP 128.178.15.7.53 > 10.92.103.53.40756: 5268 1/1/0 CNAME d.v.dropbox.com. (130)
16:09:32.634218 IP 10.92.103.53.53 > 128.178.1.196.62919: 5268 1/1/0 CNAME d.v.dropbox.com. (130)
16:09:32.634350 IP 128.178.15.7.53 > 10.92.103.53.47809: 53116 2/4/8 CNAME d.v.dropbox.com., A 162.125.32.5 (377)
16:09:32.634524 IP 10.92.103.53.53 > 128.178.1.196.62133: 53116 2/4/8 CNAME d.v.dropbox.com., A 162.125.32.5 (377)
16:09:32.634810 IP 128.178.1.196.64783 > 10.92.103.53.53: 31786+ A? d.v.dropbox.com. (33)
16:09:32.634821 IP 128.178.1.196.60248 > 10.92.103.53.53: 9575+ AAAA? d.v.dropbox.com. (33)
16:09:32.635242 IP 10.92.103.53.32833 > 128.178.15.7.53: 9575+ AAAA? d.v.dropbox.com. (33)
16:09:32.635453 IP 10.92.103.53.36402 > 128.178.15.7.53: 31786+ A? d.v.dropbox.com. (33)
16:09:32.635893 IP 128.178.15.7.53 > 10.92.103.53.32833: 9575 0/1/0 (114)
16:09:32.636067 IP 10.92.103.53.53 > 128.178.1.196.60248: 9575 0/1/0 (114)
16:09:32.636154 IP 128.178.15.7.53 > 10.92.103.53.36402: 31786 1/4/8 A 162.125.32.5 (361)
16:09:32.636379 IP 10.92.103.53.53 > 128.178.1.196.64783: 31786 1/4/8 A 162.125.32.5 (361)
16:09:34.840013 IP 128.178.1.196.55756 > 10.92.103.53.53: 60139+ PTR? lb._dns-sd._udp.node.consul. (45)
16:09:34.840034 IP 128.178.1.196.56097 > 10.92.103.53.53: 20523+ PTR? db._dns-sd._udp.node.consul. (45)
16:09:34.840343 IP 10.92.103.53.53 > 128.178.1.196.56097: 20523* 0/0/0 (45)
16:09:34.840536 IP 10.92.103.53.53 > 128.178.1.196.55756: 60139* 0/0/0 (45)
16:09:57.668811 IP 128.178.1.196.54978 > 10.92.103.53.53: 6665+ A? z.zufferey.com. (32)
16:09:57.669044 IP 10.92.103.53.44108 > 128.178.15.7.53: 6665+ A? z.zufferey.com. (32)
16:09:57.773834 IP 128.178.15.7.53 > 10.92.103.53.44108: 6665 2/2/3 CNAME 84-75-228-83.dclient.hispeed.ch., A 84.75.228.83 (201)
16:09:57.774075 IP 10.92.103.53.53 > 128.178.1.196.54978: 6665 2/2/3 CNAME 84-75-228-83.dclient.hispeed.ch., A 84.75.228.83 (201)
16:10:05.533803 IP 128.178.1.196.62134 > 10.92.103.53.53: 20035+ A? bolt.v.dropbox.com. (36)
16:10:05.533819 IP 128.178.1.196.53070 > 10.92.103.53.53: 55391+ AAAA? bolt.v.dropbox.com. (36)
16:10:05.534264 IP 10.92.103.53.52367 > 128.178.15.7.53: 55391+ AAAA? bolt.v.dropbox.com. (36)
16:10:05.534510 IP 10.92.103.53.36701 > 128.178.15.7.53: 20035+ A? bolt.v.dropbox.com. (36)
16:10:05.535040 IP 128.178.15.7.53 > 10.92.103.53.52367: 55391 0/1/0 (117)
16:10:05.535183 IP 10.92.103.53.53 > 128.178.1.196.53070: 55391 0/1/0 (117)
16:10:05.541126 IP 128.178.15.7.53 > 10.92.103.53.36701: 20035 1/4/8 A 162.125.18.133 (364)
16:10:05.541261 IP 10.92.103.53.53 > 128.178.1.196.62134: 20035 1/4/8 A 162.125.18.133 (364)
16:10:14.296200 IP 128.179.156.146.41324 > 10.92.103.53.53: 46527+ A? www.youtube.com. (33)
16:10:14.296233 IP 128.179.156.146.41324 > 10.92.103.53.53: 8349+ AAAA? www.youtube.com. (33)
16:10:14.296685 IP 10.92.103.53.39916 > 128.178.15.7.53: 8349+ AAAA? www.youtube.com. (33)
16:10:14.296979 IP 10.92.103.53.53677 > 128.178.15.7.53: 46527+ A? www.youtube.com. (33)
16:10:14.297642 IP 128.178.15.7.53 > 10.92.103.53.39916: 8349 2/4/4 CNAME youtube-ui.l.google.com., AAAA 2a00:1450:400a:805::200e (231)
16:10:14.297654 IP 128.178.15.7.53 > 10.92.103.53.53677: 46527 2/4/4 CNAME youtube-ui.l.google.com., A 172.217.16.142 (219)
16:10:14.297926 IP 10.92.103.53.53 > 128.179.156.146.41324: 46527 2/4/4 CNAME youtube-ui.l.google.com., A 172.217.16.142 (219)
16:10:14.298160 IP 10.92.103.53.53 > 128.179.156.146.41324: 8349 2/4/4 CNAME youtube-ui.l.google.com., AAAA 2a00:1450:400a:805::200e (231)
16:10:14.301051 IP 128.179.156.146.38048 > 10.92.103.53.53: 21208+ A? www.youtube.com. (33)
16:10:14.301060 IP 128.179.156.146.38048 > 10.92.103.53.53: 46621+ AAAA? www.youtube.com. (33)
16:10:14.301375 IP 10.92.103.53.49209 > 128.178.15.7.53: 46621+ AAAA? www.youtube.com. (33)
16:10:14.301620 IP 10.92.103.53.44410 > 128.178.15.7.53: 21208+ A? www.youtube.com. (33)
16:10:14.302242 IP 128.178.15.7.53 > 10.92.103.53.49209: 46621 2/4/4 CNAME youtube-ui.l.google.com., AAAA 2a00:1450:400a:805::200e (231)
16:10:14.302255 IP 128.178.15.7.53 > 10.92.103.53.44410: 21208 2/4/4 CNAME youtube-ui.l.google.com., A 172.217.16.142 (219)
16:10:14.302432 IP 10.92.103.53.53 > 128.179.156.146.38048: 21208 2/4/4 CNAME youtube-ui.l.google.com., A 172.217.16.142 (219)
16:10:14.302657 IP 10.92.103.53.53 > 128.179.156.146.38048: 46621 2/4/4 CNAME youtube-ui.l.google.com., AAAA 2a00:1450:400a:805::200e (231)
16:10:24.376693 IP 128.178.1.196.58401 > 10.92.103.53.53: 18119+ A? clients4.google.com. (37)
16:10:24.377091 IP 10.92.103.53.40937 > 128.178.15.7.53: 18119+ A? clients4.google.com. (37)
16:10:24.378077 IP 128.178.15.7.53 > 10.92.103.53.40937: 18119 2/4/4 CNAME clients.l.google.com., A 172.217.18.110 (213)
16:10:24.378344 IP 10.92.103.53.53 > 128.178.1.196.58401: 18119 2/4/4 CNAME clients.l.google.com., A 172.217.18.110 (213)
16:10:45.393720 IP 128.178.1.196.51285 > 10.92.103.53.53: 62653+ A? docs.google.com. (33)
16:10:45.393739 IP 128.178.1.196.54671 > 10.92.103.53.53: 46614+ A? googleapis.l.google.com. (41)
16:10:45.394234 IP 10.92.103.53.58624 > 128.178.15.7.53: 46614+ A? googleapis.l.google.com. (41)
16:10:45.394477 IP 10.92.103.53.55253 > 128.178.15.7.53: 62653+ A? docs.google.com. (33)
16:10:45.395375 IP 128.178.15.7.53 > 10.92.103.53.58624: 46614 4/4/4 A 172.217.18.106, A 172.217.19.10, A 172.217.19.170, A 172.217.16.138 (241)
16:10:45.395666 IP 128.178.15.7.53 > 10.92.103.53.55253: 62653 1/4/4 A 172.217.18.110 (185)
16:10:45.395713 IP 10.92.103.53.53 > 128.178.1.196.54671: 46614 4/4/4 A 172.217.18.106, A 172.217.19.10, A 172.217.19.170, A 172.217.16.138 (241)
16:10:45.395911 IP 10.92.103.53.53 > 128.178.1.196.51285: 62653 1/4/4 A 172.217.18.110 (185)
16:10:50.445039 IP 10.92.104.183.44995 > 10.92.103.53.53: 4332+ AAAA? checkpoint-api.hashicorp.com. (46)
16:10:50.445157 IP 10.92.104.183.42311 > 10.92.103.53.53: 60107+ A? checkpoint-api.hashicorp.com. (46)
16:10:50.445569 IP 10.92.103.53.54474 > 128.178.15.7.53: 60107+ A? checkpoint-api.hashicorp.com. (46)
16:10:50.445812 IP 10.92.103.53.52636 > 128.178.15.7.53: 4332+ AAAA? checkpoint-api.hashicorp.com. (46)
16:10:50.496929 IP 128.178.15.7.53 > 10.92.103.53.52636: 4332 2/1/0 CNAME tochigi-2301.herokussl.com., CNAME elb046917-1045816452.us-east-1.elb.amazonaws.com. (224)
16:10:50.497138 IP 10.92.103.53.53 > 10.92.104.183.44995: 4332 2/1/0 CNAME tochigi-2301.herokussl.com., CNAME elb046917-1045816452.us-east-1.elb.amazonaws.com. (224)
16:10:50.498501 IP 128.178.15.7.53 > 10.92.103.53.54474: 60107 5/4/8 CNAME tochigi-2301.herokussl.com., CNAME elb046917-1045816452.us-east-1.elb.amazonaws.com., A 107.21.214.167, A 50.17.253.158, A 54.235.77.197 (503)
16:10:50.498725 IP 10.92.103.53.53 > 10.92.104.183.42311: 60107 5/4/8 CNAME tochigi-2301.herokussl.com., CNAME elb046917-1045816452.us-east-1.elb.amazonaws.com., A 107.21.214.167, A 50.17.253.158, A 54.235.77.197 (503)
16:11:10.888670 IP 128.178.1.196.61400 > 10.92.103.53.53: 35940+ A? plus.l.google.com. (35)
16:11:10.889024 IP 10.92.103.53.60437 > 128.178.15.7.53: 35940+ A? plus.l.google.com. (35)
16:11:10.889643 IP 128.178.15.7.53 > 10.92.103.53.60437: 35940 1/4/4 A 172.217.16.142 (187)
16:11:10.889809 IP 10.92.103.53.53 > 128.178.1.196.61400: 35940 1/4/4 A 172.217.16.142 (187)
16:11:15.023667 IP 10.92.103.53.42985 > 8.8.8.8.53: 63614+ A? github.com. (28)
16:11:15.023773 IP 10.92.103.53.42985 > 8.8.8.8.53: 2484+ AAAA? github.com. (28)
16:11:15.029540 IP 8.8.8.8.53 > 10.92.103.53.42985: 63614 2/0/0 A 192.30.253.113, A 192.30.253.112 (60)
16:11:15.029557 IP 8.8.8.8.53 > 10.92.103.53.42985: 2484 0/1/0 (112)
16:11:54.338134 IP 128.178.1.196.49161 > 10.92.103.53.53: 42858+ PTR? 1.1.178.128.in-addr.arpa. (42)
16:11:54.339075 IP 10.92.103.53.47506 > 128.178.15.7.53: 42858+ PTR? 1.1.178.128.in-addr.arpa. (42)
16:11:54.343787 IP 128.178.15.7.53 > 10.92.103.53.47506: 42858* 1/2/4 PTR cv-ic-dit-v1000-ro.epfl.ch. (214)
16:11:54.344150 IP 10.92.103.53.53 > 128.178.1.196.49161: 42858* 1/2/4 PTR cv-ic-dit-v1000-ro.epfl.ch. (214)
16:11:54.348698 IP 128.178.1.196.51178 > 10.92.103.53.53: 17988+ PTR? 18.100.178.128.in-addr.arpa. (45)
16:11:54.349226 IP 10.92.103.53.51180 > 128.178.15.7.53: 17988+ PTR? 18.100.178.128.in-addr.arpa. (45)
16:11:54.353744 IP 128.178.15.7.53 > 10.92.103.53.51180: 17988* 1/2/4 PTR cv-gigado-v100.epfl.ch. (213)
16:11:54.353979 IP 10.92.103.53.53 > 128.178.1.196.51178: 17988* 1/2/4 PTR cv-gigado-v100.epfl.ch. (213)
16:11:54.601811 IP 128.178.1.196.54379 > 10.92.103.53.53: 25220+ PTR? 1.200.178.128.in-addr.arpa. (44)
16:11:54.602523 IP 10.92.103.53.50424 > 128.178.15.7.53: 25220+ PTR? 1.200.178.128.in-addr.arpa. (44)
16:11:54.611371 IP 128.178.15.7.53 > 10.92.103.53.50424: 25220* 1/2/4 PTR c6-ext-v200.epfl.ch. (209)
16:11:54.611723 IP 10.92.103.53.53 > 128.178.1.196.54379: 25220* 1/2/4 PTR c6-ext-v200.epfl.ch. (209)
16:11:54.616087 IP 128.178.1.196.53720 > 10.92.103.53.53: 7646+ PTR? 33.209.33.192.in-addr.arpa. (44)
16:11:54.616598 IP 10.92.103.53.40202 > 128.178.15.7.53: 7646+ PTR? 33.209.33.192.in-addr.arpa. (44)
16:11:54.625465 IP 128.178.15.7.53 > 10.92.103.53.40202: 7646* 1/2/4 PTR swiel2.epfl.ch. (204)
16:11:54.625802 IP 10.92.103.53.53 > 128.178.1.196.53720: 7646* 1/2/4 PTR swiel2.epfl.ch. (204)
16:11:54.634733 IP 128.178.1.196.52773 > 10.92.103.53.53: 48025+ PTR? 193.38.59.130.in-addr.arpa. (44)
16:11:54.646714 IP 10.92.103.53.38668 > 128.178.15.7.53: 48025+ PTR? 193.38.59.130.in-addr.arpa. (44)
16:11:54.648022 IP 128.178.15.7.53 > 10.92.103.53.38668: 48025 1/2/4 PTR swiCE1-100GE-0-1-0-3.switch.ch. (215)
16:11:54.659000 IP 10.92.103.53.53 > 128.178.1.196.52773: 48025 1/2/4 PTR swiCE1-100GE-0-1-0-3.switch.ch. (215)
16:11:54.886322 IP 128.178.1.196.54709 > 10.92.103.53.53: 64684+ PTR? 82.38.59.130.in-addr.arpa. (43)
16:11:54.886999 IP 10.92.103.53.49185 > 128.178.15.7.53: 64684+ PTR? 82.38.59.130.in-addr.arpa. (43)
16:11:54.891504 IP 128.178.15.7.53 > 10.92.103.53.49185: 64684 1/2/4 PTR swiCE3-P3.switch.ch. (203)
16:11:54.891826 IP 10.92.103.53.53 > 128.178.1.196.54709: 64684 1/2/4 PTR swiCE3-P3.switch.ch. (203)
16:11:54.905848 IP 128.178.1.196.51066 > 10.92.103.53.53: 19717+ PTR? 163.185.65.192.in-addr.arpa. (45)
16:11:54.906409 IP 10.92.103.53.42868 > 128.178.15.7.53: 19717+ PTR? 163.185.65.192.in-addr.arpa. (45)
16:11:54.933900 IP 128.178.15.7.53 > 10.92.103.53.42868: 19717 1/3/6 PTR cixp-upc.cern.ch. (283)
16:11:54.934218 IP 10.92.103.53.53 > 128.178.1.196.51066: 19717 1/3/6 PTR cixp-upc.cern.ch. (283)
16:11:54.948175 IP 128.178.1.196.55187 > 10.92.103.53.53: 49935+ PTR? 153.133.116.84.in-addr.arpa. (45)
16:11:54.948677 IP 10.92.103.53.44185 > 128.178.15.7.53: 49935+ PTR? 153.133.116.84.in-addr.arpa. (45)
16:11:54.983968 IP 128.178.15.7.53 > 10.92.103.53.44185: 49935 1/2/3 PTR ch-nax01a-ra1-ae0-0.aorta.net. (191)
16:11:54.993291 IP 10.92.103.53.53 > 128.178.1.196.55187: 49935 1/2/3 PTR ch-nax01a-ra1-ae0-0.aorta.net. (191)
16:11:55.006086 IP 128.178.1.196.65418 > 10.92.103.53.53: 40731+ PTR? 250.204.116.84.in-addr.arpa. (45)
16:11:55.006529 IP 10.92.103.53.52391 > 128.178.15.7.53: 40731+ PTR? 250.204.116.84.in-addr.arpa. (45)
16:11:55.089307 IP 128.178.15.7.53 > 10.92.103.53.52391: 40731 1/2/3 PTR carnax202-bundle-ether1.aorta.net. (195)
16:11:55.089512 IP 10.92.103.53.53 > 128.178.1.196.65418: 40731 1/2/3 PTR carnax202-bundle-ether1.aorta.net. (195)
16:12:00.886386 IP 128.178.1.196.60781 > 10.92.103.53.53: 2256+ A? csi.gstatic.com. (33)
16:12:00.886577 IP 10.92.103.53.59603 > 128.178.15.7.53: 2256+ A? csi.gstatic.com. (33)
16:12:00.887420 IP 128.178.15.7.53 > 10.92.103.53.59603: 2256 1/4/4 A 216.58.222.195 (192)
16:12:00.887546 IP 10.92.103.53.53 > 128.178.1.196.60781: 2256 1/4/4 A 216.58.222.195 (192)
16:12:05.887821 IP 128.178.1.196.50317 > 10.92.103.53.53: 946+ A? clients6.google.com. (37)
16:12:05.888218 IP 10.92.103.53.46398 > 128.178.15.7.53: 946+ A? clients6.google.com. (37)
16:12:05.893005 IP 128.178.15.7.53 > 10.92.103.53.46398: 946 2/4/4 CNAME clients.l.google.com., A 172.217.18.110 (213)
16:12:05.893310 IP 10.92.103.53.53 > 128.178.1.196.50317: 946 2/4/4 CNAME clients.l.google.com., A 172.217.18.110 (213)
16:12:25.292345 IP 128.178.1.196.58044 > 10.92.103.53.53: 43360+ A? www.google.ch. (31)
16:12:25.292851 IP 10.92.103.53.35916 > 128.178.15.7.53: 43360+ A? www.google.ch. (31)
16:12:25.293690 IP 128.178.15.7.53 > 10.92.103.53.35916: 43360 1/4/4 A 172.217.16.131 (193)
16:12:25.293999 IP 10.92.103.53.53 > 128.178.1.196.58044: 43360 1/4/4 A 172.217.16.131 (193)
16:12:27.837423 IP 128.178.1.196.64651 > 10.92.103.53.53: 2968+ A? clients5.google.com. (37)
16:12:27.837442 IP 128.178.1.196.61247 > 10.92.103.53.53: 17257+ A? id.l.google.com. (33)
16:12:27.837445 IP 128.178.1.196.65239 > 10.92.103.53.53: 48173+ A? googlehosted.l.googleusercontent.com. (54)
16:12:27.837603 IP 128.178.1.196.56310 > 10.92.103.53.53: 5857+ A? www3.l.google.com. (35)
16:12:27.838140 IP 10.92.103.53.45166 > 128.178.15.7.53: 5857+ A? www3.l.google.com. (35)
16:12:27.838378 IP 10.92.103.53.54249 > 128.178.15.7.53: 2968+ A? clients5.google.com. (37)
16:12:27.838669 IP 10.92.103.53.48349 > 128.178.15.7.53: 17257+ A? id.l.google.com. (33)
16:12:27.838867 IP 128.178.15.7.53 > 10.92.103.53.45166: 5857 1/4/4 A 172.217.16.142 (187)
16:12:27.839019 IP 128.178.15.7.53 > 10.92.103.53.54249: 2968 2/4/4 CNAME clients.l.google.com., A 172.217.16.142 (213)
16:12:27.839106 IP 10.92.103.53.51092 > 128.178.15.7.53: 48173+ A? googlehosted.l.googleusercontent.com. (54)
16:12:27.839331 IP 128.178.15.7.53 > 10.92.103.53.48349: 17257 1/4/4 A 172.217.19.163 (185)
16:12:27.839483 IP 10.92.103.53.53 > 128.178.1.196.61247: 17257 1/4/4 A 172.217.19.163 (185)
16:12:27.839697 IP 128.178.1.196.51494 > 10.92.103.53.53: 56242+ A? www.gstatic.com. (33)
16:12:27.839868 IP 128.178.15.7.53 > 10.92.103.53.51092: 48173 1/4/4 A 172.217.18.97 (213)
16:12:27.839920 IP 10.92.103.53.53 > 128.178.1.196.64651: 2968 2/4/4 CNAME clients.l.google.com., A 172.217.16.142 (213)
16:12:27.840096 IP 10.92.103.53.53 > 128.178.1.196.56310: 5857 1/4/4 A 172.217.16.142 (187)
16:12:27.840305 IP 10.92.103.53.53 > 128.178.1.196.65239: 48173 1/4/4 A 172.217.18.97 (213)
16:12:27.840693 IP 10.92.103.53.45398 > 128.178.15.7.53: 56242+ A? www.gstatic.com. (33)
16:12:27.841623 IP 128.178.15.7.53 > 10.92.103.53.45398: 56242 1/4/4 A 172.217.18.99 (192)
16:12:27.841755 IP 128.178.1.196.62762 > 10.92.103.53.53: 24842+ A? www.google.com. (32)
16:12:27.841864 IP 10.92.103.53.53 > 128.178.1.196.51494: 56242 1/4/4 A 172.217.18.99 (192)
16:12:27.842174 IP 10.92.103.53.33966 > 128.178.15.7.53: 24842+ A? www.google.com. (32)
16:12:27.843012 IP 128.178.15.7.53 > 10.92.103.53.33966: 24842 1/4/4 A 172.217.18.100 (184)
16:12:27.843152 IP 10.92.103.53.53 > 128.178.1.196.62762: 24842 1/4/4 A 172.217.18.100 (184)
16:12:28.050450 IP 128.178.1.196.49216 > 10.92.103.53.53: 19922+ A? play.google.com. (33)
16:12:28.050890 IP 10.92.103.53.50163 > 128.178.15.7.53: 19922+ A? play.google.com. (33)
16:12:28.051550 IP 128.178.15.7.53 > 10.92.103.53.50163: 19922 2/4/4 CNAME play.l.google.com., A 172.217.16.142 (206)
16:12:28.051787 IP 10.92.103.53.53 > 128.178.1.196.49216: 19922 2/4/4 CNAME play.l.google.com., A 172.217.16.142 (206)
16:12:33.603286 IP 128.178.1.196.56572 > 10.92.103.53.53: 38899+ A? fonts.gstatic.com. (35)
16:12:33.603655 IP 10.92.103.53.52812 > 128.178.15.7.53: 38899+ A? fonts.gstatic.com. (35)
16:12:33.604218 IP 128.178.15.7.53 > 10.92.103.53.52812: 38899 2/4/4 CNAME gstaticadssl.l.google.com., A 172.217.16.131 (223)
16:12:33.604524 IP 10.92.103.53.53 > 128.178.1.196.56572: 38899 2/4/4 CNAME gstaticadssl.l.google.com., A 172.217.16.131 (223)
16:12:35.305588 IP 128.178.1.196.64020 > 10.92.103.53.53: 64614+ A? clients4.google.com. (37)
16:12:35.305912 IP 10.92.103.53.49580 > 128.178.15.7.53: 64614+ A? clients4.google.com. (37)
16:12:35.306817 IP 128.178.15.7.53 > 10.92.103.53.49580: 64614 2/4/4 CNAME clients.l.google.com., A 172.217.16.142 (213)
16:12:35.307038 IP 10.92.103.53.53 > 128.178.1.196.64020: 64614 2/4/4 CNAME clients.l.google.com., A 172.217.16.142 (213)
16:12:35.749811 IP 128.178.1.196.60277 > 10.92.103.53.53: 31271+ A? github.com. (28)
16:12:35.749839 IP 128.178.1.196.55969 > 10.92.103.53.53: 27341+ A? api.github.com. (32)
16:12:35.749841 IP 128.178.1.196.52914 > 10.92.103.53.53: 40387+ A? assets-cdn.github.com. (39)
16:12:35.750023 IP 128.178.1.196.54792 > 10.92.103.53.53: 41529+ A? avatars0.githubusercontent.com. (48)
16:12:35.750035 IP 128.178.1.196.56200 > 10.92.103.53.53: 5311+ A? avatars1.githubusercontent.com. (48)
16:12:35.750270 IP 128.178.1.196.59812 > 10.92.103.53.53: 35513+ A? avatars3.githubusercontent.com. (48)
16:12:35.750992 IP 10.92.103.53.32790 > 128.178.15.7.53: 35513+ A? avatars3.githubusercontent.com. (48)
16:12:35.751249 IP 10.92.103.53.58509 > 128.178.15.7.53: 31271+ A? github.com. (28)
16:12:35.751514 IP 10.92.103.53.41754 > 128.178.15.7.53: 27341+ A? api.github.com. (32)
16:12:35.751737 IP 10.92.103.53.38500 > 128.178.15.7.53: 40387+ A? assets-cdn.github.com. (39)
16:12:35.751824 IP 128.178.15.7.53 > 10.92.103.53.58509: 31271 2/8/11 A 192.30.253.113, A 192.30.253.112 (504)
16:12:35.751996 IP 10.92.103.53.57239 > 128.178.15.7.53: 41529+ A? avatars0.githubusercontent.com. (48)
16:12:35.752256 IP 10.92.103.53.38069 > 128.178.15.7.53: 5311+ A? avatars1.githubusercontent.com. (48)
16:12:35.752553 IP 10.92.103.53.53 > 128.178.1.196.60277: 31271 2/8/11 A 192.30.253.113, A 192.30.253.112 (504)
16:12:35.752812 IP 128.178.15.7.53 > 10.92.103.53.38069: 5311 2/4/4 CNAME github.map.fastly.net., A 151.101.36.133 (235)
16:12:35.752983 IP 10.92.103.53.53 > 128.178.1.196.56200: 5311 2/4/4 CNAME github.map.fastly.net., A 151.101.36.133 (235)
16:12:35.753125 IP 128.178.15.7.53 > 10.92.103.53.57239: 41529 2/4/4 CNAME github.map.fastly.net., A 151.101.36.133 (235)
16:12:35.753312 IP 10.92.103.53.53 > 128.178.1.196.54792: 41529 2/4/4 CNAME github.map.fastly.net., A 151.101.36.133 (235)
16:12:35.754026 IP 128.178.1.196.51018 > 10.92.103.53.53: 55984+ A? www.google-analytics.com. (42)
16:12:35.754253 IP 10.92.103.53.51158 > 128.178.15.7.53: 55984+ A? www.google-analytics.com. (42)
16:12:35.754668 IP 128.178.1.196.55055 > 10.92.103.53.53: 38219+ A? cloud.githubusercontent.com. (45)
16:12:35.754676 IP 128.178.1.196.54543 > 10.92.103.53.53: 9460+ A? camo.githubusercontent.com. (44)
16:12:35.754931 IP 10.92.103.53.44822 > 128.178.15.7.53: 9460+ A? camo.githubusercontent.com. (44)
16:12:35.755172 IP 10.92.103.53.56677 > 128.178.15.7.53: 38219+ A? cloud.githubusercontent.com. (45)
16:12:35.755211 IP 128.178.15.7.53 > 10.92.103.53.51158: 55984 2/4/4 CNAME www-google-analytics.l.google.com., A 172.217.16.142 (238)
16:12:35.755484 IP 10.92.103.53.53 > 128.178.1.196.51018: 55984 2/4/4 CNAME www-google-analytics.l.google.com., A 172.217.16.142 (238)
16:12:35.755720 IP 128.178.15.7.53 > 10.92.103.53.56677: 38219 2/4/4 CNAME github.map.fastly.net., A 151.101.36.133 (232)
16:12:35.755890 IP 10.92.103.53.53 > 128.178.1.196.55055: 38219 2/4/4 CNAME github.map.fastly.net., A 151.101.36.133 (232)
16:12:35.756702 IP 128.178.1.196.49580 > 10.92.103.53.53: 85+ A? collector.githubapp.com. (41)
16:12:35.756987 IP 10.92.103.53.50253 > 128.178.15.7.53: 85+ A? collector.githubapp.com. (41)
16:12:35.768520 IP 128.178.15.7.53 > 10.92.103.53.32790: 35513 2/4/4 CNAME github.map.fastly.net., A 151.101.60.133 (235)
16:12:35.768719 IP 10.92.103.53.53 > 128.178.1.196.59812: 35513 2/4/4 CNAME github.map.fastly.net., A 151.101.60.133 (235)
16:12:35.769175 IP 128.178.15.7.53 > 10.92.103.53.41754: 27341 2/8/11 A 192.30.253.117, A 192.30.253.116 (508)
16:12:35.769308 IP 10.92.103.53.53 > 128.178.1.196.55969: 27341 2/8/11 A 192.30.253.117, A 192.30.253.116 (508)
16:12:35.770333 IP 128.178.15.7.53 > 10.92.103.53.38500: 40387 2/4/4 CNAME github.map.fastly.net., A 151.101.36.133 (226)
16:12:35.770484 IP 10.92.103.53.53 > 128.178.1.196.52914: 40387 2/4/4 CNAME github.map.fastly.net., A 151.101.36.133 (226)
16:12:35.771863 IP 128.178.15.7.53 > 10.92.103.53.44822: 9460 2/4/4 CNAME github.map.fastly.net., A 151.101.36.133 (231)
16:12:35.776634 IP 10.92.103.53.53 > 128.178.1.196.54543: 9460 2/4/4 CNAME github.map.fastly.net., A 151.101.36.133 (231)
16:12:35.800818 IP 128.178.15.7.53 > 10.92.103.53.50253: 85 4/4/8 CNAME analytics-collector-28944298.us-east-1.elb.amazonaws.com., A 52.7.136.125, A 52.45.81.83, A 34.196.249.149 (469)
16:12:35.801979 IP 10.92.103.53.53 > 128.178.1.196.49580: 85 4/4/8 CNAME analytics-collector-28944298.us-east-1.elb.amazonaws.com., A 52.7.136.125, A 52.45.81.83, A 34.196.249.149 (469)
16:12:36.928449 IP 128.178.1.196.58976 > 10.92.103.53.53: 28729+ A? avatars2.githubusercontent.com. (48)
16:12:36.928734 IP 10.92.103.53.60473 > 128.178.15.7.53: 28729+ A? avatars2.githubusercontent.com. (48)
16:12:36.945768 IP 128.178.15.7.53 > 10.92.103.53.60473: 28729 2/4/4 CNAME github.map.fastly.net., A 151.101.36.133 (235)
16:12:36.945926 IP 10.92.103.53.53 > 128.178.1.196.58976: 28729 2/4/4 CNAME github.map.fastly.net., A 151.101.36.133 (235)
16:12:37.558291 IP 128.178.1.196.55784 > 10.92.103.53.53: 53307+ A? live.github.com. (33)
16:12:37.558552 IP 10.92.103.53.46240 > 128.178.15.7.53: 53307+ A? live.github.com. (33)
16:12:37.583553 IP 128.178.15.7.53 > 10.92.103.53.46240: 53307 2/8/11 A 192.30.253.125, A 192.30.253.124 (497)
16:12:37.583738 IP 10.92.103.53.53 > 128.178.1.196.55784: 53307 2/8/11 A 192.30.253.125, A 192.30.253.124 (497)
16:13:11.323001 IP 128.178.1.196.49663 > 10.92.103.53.53: 44105+ A? zuzu123-1.node.consul. (39)
16:13:11.323018 IP 128.178.1.196.62108 > 10.92.103.53.53: 9441+ AAAA? zuzu123-1.node.consul. (39)
16:13:11.323558 IP 10.92.103.53.53 > 128.178.1.196.62108: 9441* 0/0/0 (39)
16:13:11.323832 IP 10.92.103.53.53 > 128.178.1.196.49663: 44105* 1/0/0 A 10.92.104.160 (55)
16:13:11.324113 IP 128.178.1.196.50881 > 10.92.103.53.53: 5096+ AAAA? zuzu123-1.epfl.ch. (35)
16:13:11.324441 IP 10.92.103.53.37347 > 128.178.15.7.53: 5096+ AAAA? zuzu123-1.epfl.ch. (35)
16:13:11.325206 IP 128.178.15.7.53 > 10.92.103.53.37347: 5096 NXDomain* 0/1/0 (89)
16:13:11.325362 IP 10.92.103.53.53 > 128.178.1.196.50881: 5096 NXDomain* 0/1/0 (89)
16:13:26.828913 IP 10.92.104.160.34227 > 10.92.103.53.53: 16486+ A? zuzu123-2.node.consul. (39)
16:13:26.828938 IP 10.92.104.160.34227 > 10.92.103.53.53: 35532+ AAAA? zuzu123-2.node.consul. (39)
16:13:26.829543 IP 10.92.103.53.53 > 10.92.104.160.34227: 35532* 0/0/0 (39)
16:13:26.829820 IP 10.92.103.53.53 > 10.92.104.160.34227: 16486* 1/0/0 A 10.92.104.161 (55)
16:13:27.132791 IP 10.92.104.160.39507 > 10.92.103.53.53: 61562+ A? zuzu123-2.node.consul. (39)
16:13:27.132836 IP 10.92.104.160.39507 > 10.92.103.53.53: 8436+ AAAA? zuzu123-2.node.consul. (39)
16:13:27.133449 IP 10.92.103.53.53 > 10.92.104.160.39507: 8436* 0/0/0 (39)
16:13:27.133840 IP 10.92.103.53.53 > 10.92.104.160.39507: 61562* 1/0/0 A 10.92.104.161 (55)
16:13:27.954845 IP 10.92.104.161.59193 > 10.92.103.53.53: 24070+ SRV? _http._tcp.security.ubuntu.com. (48)
16:13:27.955291 IP 10.92.103.53.52845 > 128.178.15.7.53: 24070+ SRV? _http._tcp.security.ubuntu.com. (48)
16:13:27.956096 IP 128.178.15.7.53 > 10.92.103.53.52845: 24070 NXDomain 0/1/0 (109)
16:13:27.956283 IP 10.92.103.53.53 > 10.92.104.161.59193: 24070 NXDomain 0/1/0 (109)
16:13:27.957501 IP 10.92.104.161.46722 > 10.92.103.53.53: 15287+ A? security.ubuntu.com. (37)
16:13:27.957624 IP 10.92.104.161.46722 > 10.92.103.53.53: 48494+ AAAA? security.ubuntu.com. (37)
16:13:27.957973 IP 10.92.103.53.42185 > 128.178.15.7.53: 48494+ AAAA? security.ubuntu.com. (37)
16:13:27.958195 IP 10.92.103.53.44283 > 128.178.15.7.53: 15287+ A? security.ubuntu.com. (37)
16:13:27.958905 IP 10.92.104.161.35487 > 10.92.103.53.53: 35570+ SRV? _http._tcp.us.archive.ubuntu.com. (50)
16:13:27.959241 IP 10.92.104.161.34594 > 10.92.103.53.53: 25700+ A? deb.nodesource.com. (36)
16:13:27.959390 IP 10.92.104.161.34594 > 10.92.103.53.53: 1964+ AAAA? deb.nodesource.com. (36)
16:13:27.959464 IP 10.92.103.53.33236 > 128.178.15.7.53: 35570+ SRV? _http._tcp.us.archive.ubuntu.com. (50)
16:13:27.959850 IP 10.92.103.53.54799 > 128.178.15.7.53: 1964+ AAAA? deb.nodesource.com. (36)
16:13:27.959971 IP 128.178.15.7.53 > 10.92.103.53.33236: 35570 NXDomain 0/1/0 (111)
16:13:27.960142 IP 10.92.103.53.59128 > 128.178.15.7.53: 25700+ A? deb.nodesource.com. (36)
16:13:27.960291 IP 10.92.103.53.53 > 10.92.104.161.35487: 35570 NXDomain 0/1/0 (111)
16:13:27.961130 IP 10.92.104.161.42141 > 10.92.103.53.53: 1754+ A? us.archive.ubuntu.com. (39)
16:13:27.961228 IP 10.92.104.161.42141 > 10.92.103.53.53: 53960+ AAAA? us.archive.ubuntu.com. (39)
16:13:27.961484 IP 10.92.103.53.49886 > 128.178.15.7.53: 53960+ AAAA? us.archive.ubuntu.com. (39)
16:13:27.961706 IP 10.92.103.53.56872 > 128.178.15.7.53: 1754+ A? us.archive.ubuntu.com. (39)
16:13:27.975849 IP 128.178.15.7.53 > 10.92.103.53.44283: 15287 6/4/4 A 91.189.88.161, A 91.189.88.162, A 91.189.91.23, A 91.189.91.26, A 91.189.88.149, A 91.189.88.152 (283)
16:13:27.976174 IP 10.92.103.53.53 > 10.92.104.161.46722: 15287 6/4/4 A 91.189.88.161, A 91.189.88.162, A 91.189.91.23, A 91.189.91.26, A 91.189.88.149, A 91.189.88.152 (283)
16:13:27.980087 IP 128.178.15.7.53 > 10.92.103.53.56872: 1754 2/4/4 A 91.189.91.23, A 91.189.91.26 (221)
16:13:27.980299 IP 10.92.103.53.53 > 10.92.104.161.42141: 1754 2/4/4 A 91.189.91.23, A 91.189.91.26 (221)
16:13:27.981870 IP 128.178.15.7.53 > 10.92.103.53.42185: 48494 6/4/4 AAAA 2001:67c:1360:8001::21, AAAA 2001:67c:1560:8001::14, AAAA 2001:67c:1562::19, AAAA 2001:67c:1562::16, AAAA 2001:67c:1360:8001::17, AAAA 2001:67c:1560:8001::11 (355)
16:13:27.982156 IP 10.92.103.53.53 > 10.92.104.161.46722: 48494 6/4/4 AAAA 2001:67c:1360:8001::21, AAAA 2001:67c:1560:8001::14, AAAA 2001:67c:1562::19, AAAA 2001:67c:1562::16, AAAA 2001:67c:1360:8001::17, AAAA 2001:67c:1560:8001::11 (355)
16:13:27.984988 IP 128.178.15.7.53 > 10.92.103.53.49886: 53960 2/4/4 AAAA 2001:67c:1562::19, AAAA 2001:67c:1562::16 (245)
16:13:27.985193 IP 10.92.103.53.53 > 10.92.104.161.42141: 53960 2/4/4 AAAA 2001:67c:1562::19, AAAA 2001:67c:1562::16 (245)
16:13:28.255438 IP 128.178.15.7.53 > 10.92.103.53.54799: 1964 9/4/3 CNAME d2buw04m05mirl.cloudfront.net., AAAA 2600:9000:2047:4a00:1f:6523:6040:93a1, AAAA 2600:9000:2047:f800:1f:6523:6040:93a1, AAAA 2600:9000:2047:a600:1f:6523:6040:93a1, AAAA 2600:9000:2047:da00:1f:6523:6040:93a1, AAAA 2600:9000:2047:1800:1f:6523:6040:93a1, AAAA 2600:9000:2047:d200:1f:6523:6040:93a1, AAAA 2600:9000:2047:e200:1f:6523:6040:93a1, AAAA 2600:9000:2047:400:1f:6523:6040:93a1 (495)
16:13:28.255652 IP 10.92.103.53.53 > 10.92.104.161.34594: 1964 9/4/3 CNAME d2buw04m05mirl.cloudfront.net., AAAA 2600:9000:2047:4a00:1f:6523:6040:93a1, AAAA 2600:9000:2047:f800:1f:6523:6040:93a1, AAAA 2600:9000:2047:a600:1f:6523:6040:93a1, AAAA 2600:9000:2047:da00:1f:6523:6040:93a1, AAAA 2600:9000:2047:1800:1f:6523:6040:93a1, AAAA 2600:9000:2047:d200:1f:6523:6040:93a1, AAAA 2600:9000:2047:e200:1f:6523:6040:93a1, AAAA 2600:9000:2047:400:1f:6523:6040:93a1 (495)
16:13:28.258753 IP 128.178.15.7.53 > 10.92.103.53.59128: 25700 9/4/7 CNAME d2buw04m05mirl.cloudfront.net., A 52.222.157.254, A 52.222.157.94, A 52.222.157.85, A 52.222.157.20, A 52.222.157.117, A 52.222.157.15, A 52.222.157.111, A 52.222.157.190 (487)
16:13:28.258968 IP 10.92.103.53.53 > 10.92.104.161.34594: 25700 9/4/7 CNAME d2buw04m05mirl.cloudfront.net., A 52.222.157.254, A 52.222.157.94, A 52.222.157.85, A 52.222.157.20, A 52.222.157.117, A 52.222.157.15, A 52.222.157.111, A 52.222.157.190 (487)
16:13:36.008962 IP 128.178.1.196.50527 > 10.92.103.53.53: 24674+ A? detectportal.firefox.com. (42)
16:13:36.009252 IP 10.92.103.53.36069 > 128.178.15.7.53: 24674+ A? detectportal.firefox.com. (42)
16:13:36.009834 IP 128.178.15.7.53 > 10.92.103.53.36069: 24674 4/9/9 CNAME detectportal.firefox.com.edgesuite.net., CNAME a1089.d.akamai.net., A 195.176.255.175, A 195.176.255.144 (473)
16:13:36.010073 IP 10.92.103.53.53 > 128.178.1.196.50527: 24674 4/9/9 CNAME detectportal.firefox.com.edgesuite.net., CNAME a1089.d.akamai.net., A 195.176.255.175, A 195.176.255.144 (473)
16:13:41.666864 IP 10.92.104.160.51882 > 10.92.103.53.53: 13372+ A? dojo-app-1.node.consul. (40)
16:13:41.666874 IP 10.92.104.160.51882 > 10.92.103.53.53: 62320+ AAAA? dojo-app-1.node.consul. (40)
16:13:41.667304 IP 10.92.103.53.53 > 10.92.104.160.51882: 62320* 0/0/0 (40)
16:13:41.667625 IP 10.92.103.53.53 > 10.92.104.160.51882: 13372* 1/0/0 A 10.92.104.213 (56)
16:13:44.003589 IP 10.92.104.160.54887 > 10.92.103.53.53: 9689+ A? zuzu123-2.node.consul. (39)
16:13:44.003614 IP 10.92.104.160.54887 > 10.92.103.53.53: 62127+ AAAA? zuzu123-2.node.consul. (39)
16:13:44.003956 IP 10.92.103.53.53 > 10.92.104.160.54887: 62127* 0/0/0 (39)
16:13:44.004211 IP 10.92.103.53.53 > 10.92.104.160.54887: 9689* 1/0/0 A 10.92.104.161 (55)
16:13:44.356482 IP 10.92.104.160.39893 > 10.92.103.53.53: 16888+ A? zuzu123-3.node.consul. (39)
16:13:44.356500 IP 10.92.104.160.39893 > 10.92.103.53.53: 4334+ AAAA? zuzu123-3.node.consul. (39)
16:13:44.356865 IP 10.92.103.53.53 > 10.92.104.160.39893: 4334* 0/0/0 (39)
16:13:44.357114 IP 10.92.103.53.53 > 10.92.104.160.39893: 16888* 1/0/0 A 10.92.104.166 (55)
16:13:45.132284 IP 10.92.104.160.40688 > 10.92.103.53.53: 15494+ A? zuzu123-3.node.consul. (39)
16:13:45.132299 IP 10.92.104.160.40688 > 10.92.103.53.53: 27659+ AAAA? zuzu123-3.node.consul. (39)
16:13:45.132799 IP 10.92.103.53.53 > 10.92.104.160.40688: 27659* 0/0/0 (39)
16:13:45.133023 IP 10.92.103.53.53 > 10.92.104.160.40688: 15494* 1/0/0 A 10.92.104.166 (55)
16:13:45.644689 IP 128.178.1.196.49679 > 10.92.103.53.53: 23508+ A? ssl.gstatic.com. (33)
16:13:45.644982 IP 10.92.103.53.46701 > 128.178.15.7.53: 23508+ A? ssl.gstatic.com. (33)
16:13:45.649292 IP 128.178.15.7.53 > 10.92.103.53.46701: 23508 1/4/4 A 172.217.18.99 (192)
16:13:45.649622 IP 10.92.103.53.53 > 128.178.1.196.49679: 23508 1/4/4 A 172.217.18.99 (192)
16:13:49.630266 IP 10.92.104.166.35913 > 10.92.103.53.53: 37438+ SRV? _http._tcp.security.ubuntu.com. (48)
16:13:49.630597 IP 10.92.103.53.40883 > 128.178.15.7.53: 37438+ SRV? _http._tcp.security.ubuntu.com. (48)
16:13:49.632004 IP 10.92.104.166.35094 > 10.92.103.53.53: 50820+ SRV? _http._tcp.us.archive.ubuntu.com. (50)
16:13:49.632314 IP 10.92.103.53.55066 > 128.178.15.7.53: 50820+ SRV? _http._tcp.us.archive.ubuntu.com. (50)
16:13:49.633048 IP 128.178.15.7.53 > 10.92.103.53.55066: 50820 NXDomain 0/1/0 (111)
16:13:49.633230 IP 10.92.103.53.53 > 10.92.104.166.35094: 50820 NXDomain 0/1/0 (111)
16:13:49.634180 IP 10.92.104.166.48596 > 10.92.103.53.53: 13111+ A? us.archive.ubuntu.com. (39)
16:13:49.634448 IP 10.92.103.53.49770 > 128.178.15.7.53: 13111+ A? us.archive.ubuntu.com. (39)
16:13:49.635233 IP 128.178.15.7.53 > 10.92.103.53.49770: 13111 2/4/4 A 91.189.91.26, A 91.189.91.23 (221)
16:13:49.635443 IP 10.92.103.53.53 > 10.92.104.166.48596: 13111 2/4/4 A 91.189.91.26, A 91.189.91.23 (221)
16:13:49.636173 IP 10.92.104.166.48596 > 10.92.103.53.53: 37104+ AAAA? us.archive.ubuntu.com. (39)
16:13:49.636458 IP 10.92.103.53.41890 > 128.178.15.7.53: 37104+ AAAA? us.archive.ubuntu.com. (39)
16:13:49.636717 IP 10.92.104.166.50312 > 10.92.103.53.53: 46405+ A? deb.nodesource.com. (36)
16:13:49.636733 IP 10.92.104.166.50312 > 10.92.103.53.53: 53614+ AAAA? deb.nodesource.com. (36)
16:13:49.637154 IP 10.92.103.53.47214 > 128.178.15.7.53: 53614+ AAAA? deb.nodesource.com. (36)
16:13:49.637409 IP 10.92.103.53.59213 > 128.178.15.7.53: 46405+ A? deb.nodesource.com. (36)
16:13:49.648569 IP 128.178.15.7.53 > 10.92.103.53.40883: 37438 NXDomain 0/1/0 (109)
16:13:49.648721 IP 10.92.103.53.53 > 10.92.104.166.35913: 37438 NXDomain 0/1/0 (109)
16:13:49.649525 IP 10.92.104.166.46920 > 10.92.103.53.53: 20453+ A? security.ubuntu.com. (37)
16:13:49.649537 IP 10.92.104.166.46920 > 10.92.103.53.53: 32147+ AAAA? security.ubuntu.com. (37)
16:13:49.650038 IP 10.92.103.53.39968 > 128.178.15.7.53: 32147+ AAAA? security.ubuntu.com. (37)
16:13:49.650320 IP 10.92.103.53.35170 > 128.178.15.7.53: 20453+ A? security.ubuntu.com. (37)
16:13:49.651047 IP 128.178.15.7.53 > 10.92.103.53.35170: 20453 6/4/4 A 91.189.88.152, A 91.189.88.149, A 91.189.91.23, A 91.189.88.162, A 91.189.88.161, A 91.189.91.26 (283)
16:13:49.651195 IP 10.92.103.53.53 > 10.92.104.166.46920: 20453 6/4/4 A 91.189.88.152, A 91.189.88.149, A 91.189.91.23, A 91.189.88.162, A 91.189.88.161, A 91.189.91.26 (283)
16:13:49.654652 IP 128.178.15.7.53 > 10.92.103.53.41890: 37104 2/4/4 AAAA 2001:67c:1562::16, AAAA 2001:67c:1562::19 (245)
16:13:49.654790 IP 10.92.103.53.53 > 10.92.104.166.48596: 37104 2/4/4 AAAA 2001:67c:1562::16, AAAA 2001:67c:1562::19 (245)
16:13:49.668208 IP 128.178.15.7.53 > 10.92.103.53.39968: 32147 6/4/4 AAAA 2001:67c:1360:8001::21, AAAA 2001:67c:1560:8001::11, AAAA 2001:67c:1560:8001::14, AAAA 2001:67c:1562::16, AAAA 2001:67c:1562::19, AAAA 2001:67c:1360:8001::17 (355)
16:13:49.668409 IP 10.92.103.53.53 > 10.92.104.166.46920: 32147 6/4/4 AAAA 2001:67c:1360:8001::21, AAAA 2001:67c:1560:8001::11, AAAA 2001:67c:1560:8001::14, AAAA 2001:67c:1562::16, AAAA 2001:67c:1562::19, AAAA 2001:67c:1360:8001::17 (355)
16:13:49.689954 IP 128.178.15.7.53 > 10.92.103.53.59213: 46405 9/4/7 CNAME d2buw04m05mirl.cloudfront.net., A 54.192.93.156, A 54.192.93.194, A 54.192.93.254, A 54.192.93.25, A 54.192.93.31, A 54.192.93.45, A 54.192.93.77, A 54.192.93.150 (487)
16:13:49.690207 IP 10.92.103.53.53 > 10.92.104.166.50312: 46405 9/4/7 CNAME d2buw04m05mirl.cloudfront.net., A 54.192.93.156, A 54.192.93.194, A 54.192.93.254, A 54.192.93.25, A 54.192.93.31, A 54.192.93.45, A 54.192.93.77, A 54.192.93.150 (487)
16:13:49.995974 IP 128.178.15.7.53 > 10.92.103.53.47214: 53614 9/4/3 CNAME d2buw04m05mirl.cloudfront.net., AAAA 2600:9000:2047:8400:1f:6523:6040:93a1, AAAA 2600:9000:2047:7a00:1f:6523:6040:93a1, AAAA 2600:9000:2047:3800:1f:6523:6040:93a1, AAAA 2600:9000:2047:7400:1f:6523:6040:93a1, AAAA 2600:9000:2047:da00:1f:6523:6040:93a1, AAAA 2600:9000:2047:de00:1f:6523:6040:93a1, AAAA 2600:9000:2047:4c00:1f:6523:6040:93a1, AAAA 2600:9000:2047:9400:1f:6523:6040:93a1 (495)
16:13:49.996290 IP 10.92.103.53.53 > 10.92.104.166.50312: 53614 9/4/3 CNAME d2buw04m05mirl.cloudfront.net., AAAA 2600:9000:2047:8400:1f:6523:6040:93a1, AAAA 2600:9000:2047:7a00:1f:6523:6040:93a1, AAAA 2600:9000:2047:3800:1f:6523:6040:93a1, AAAA 2600:9000:2047:7400:1f:6523:6040:93a1, AAAA 2600:9000:2047:da00:1f:6523:6040:93a1, AAAA 2600:9000:2047:de00:1f:6523:6040:93a1, AAAA 2600:9000:2047:4c00:1f:6523:6040:93a1, AAAA 2600:9000:2047:9400:1f:6523:6040:93a1 (495)
16:13:52.100907 IP 10.92.104.160.54558 > 10.92.103.53.53: 31825+ A? dojo-app-1.node.consul. (40)
16:13:52.100921 IP 10.92.104.160.54558 > 10.92.103.53.53: 31138+ AAAA? dojo-app-1.node.consul. (40)
16:13:52.101287 IP 10.92.103.53.53 > 10.92.104.160.54558: 31138* 0/0/0 (40)
16:13:52.101556 IP 10.92.103.53.53 > 10.92.104.160.54558: 31825* 1/0/0 A 10.92.104.213 (56)
16:13:53.898387 IP 10.92.104.160.56180 > 10.92.103.53.53: 12476+ A? dojo-app-1.node.consul. (40)
16:13:53.898420 IP 10.92.104.160.56180 > 10.92.103.53.53: 49014+ AAAA? dojo-app-1.node.consul. (40)
16:13:53.899040 IP 10.92.103.53.53 > 10.92.104.160.56180: 49014* 0/0/0 (40)
16:13:53.899322 IP 10.92.103.53.53 > 10.92.104.160.56180: 12476* 1/0/0 A 10.92.104.213 (56)
16:13:54.267744 IP 10.92.104.160.34882 > 10.92.103.53.53: 65295+ A? sdf-bill2myprint-dev.node.consul. (50)
16:13:54.267815 IP 10.92.104.160.34882 > 10.92.103.53.53: 56350+ AAAA? sdf-bill2myprint-dev.node.consul. (50)
16:13:54.281737 IP 10.92.103.53.53 > 10.92.104.160.34882: 56350* 0/0/0 (50)
16:13:54.282064 IP 10.92.103.53.53 > 10.92.104.160.34882: 65295* 1/0/0 A 10.92.104.204 (66)
16:13:54.550691 IP 10.92.104.160.36257 > 10.92.103.53.53: 21521+ A? sdf-bill2myprint-dev.node.consul. (50)
16:13:54.550730 IP 10.92.104.160.36257 > 10.92.103.53.53: 62757+ AAAA? sdf-bill2myprint-dev.node.consul. (50)
16:13:54.551254 IP 10.92.103.53.53 > 10.92.104.160.36257: 62757* 0/0/0 (50)
16:13:54.551565 IP 10.92.103.53.53 > 10.92.104.160.36257: 21521* 1/0/0 A 10.92.104.204 (66)
16:13:54.788902 IP 10.92.104.160.47686 > 10.92.103.53.53: 44891+ A? sdf-bill2myprint-dev.node.consul. (50)
16:13:54.789060 IP 10.92.104.160.47686 > 10.92.103.53.53: 62389+ AAAA? sdf-bill2myprint-dev.node.consul. (50)
16:13:54.789421 IP 10.92.103.53.53 > 10.92.104.160.47686: 62389* 0/0/0 (50)
16:13:54.789704 IP 10.92.103.53.53 > 10.92.104.160.47686: 44891* 1/0/0 A 10.92.104.204 (66)
16:13:55.010586 IP 10.92.104.160.37123 > 10.92.103.53.53: 21805+ A? sdf-bill2myprint-gil.node.consul. (50)
16:13:55.010610 IP 10.92.104.160.37123 > 10.92.103.53.53: 22617+ AAAA? sdf-bill2myprint-gil.node.consul. (50)
16:13:55.011075 IP 10.92.103.53.53 > 10.92.104.160.37123: 22617* 0/0/0 (50)
16:13:55.011338 IP 10.92.103.53.53 > 10.92.104.160.37123: 21805* 1/0/0 A 10.92.104.211 (66)
16:13:55.316481 IP 10.92.104.160.56557 > 10.92.103.53.53: 27185+ A? sdf-bill2myprint-gil.node.consul. (50)
16:13:55.316534 IP 10.92.104.160.56557 > 10.92.103.53.53: 40032+ AAAA? sdf-bill2myprint-gil.node.consul. (50)
16:13:55.317161 IP 10.92.103.53.53 > 10.92.104.160.56557: 40032* 0/0/0 (50)
16:13:55.317543 IP 10.92.103.53.53 > 10.92.104.160.56557: 27185* 1/0/0 A 10.92.104.211 (66)
16:13:55.628534 IP 10.92.104.160.56726 > 10.92.103.53.53: 3063+ A? sdf-bill2myprint-gil.node.consul. (50)
16:13:55.628576 IP 10.92.104.160.56726 > 10.92.103.53.53: 4334+ AAAA? sdf-bill2myprint-gil.node.consul. (50)
16:13:55.629129 IP 10.92.103.53.53 > 10.92.104.160.56726: 4334* 0/0/0 (50)
16:13:55.629430 IP 10.92.103.53.53 > 10.92.104.160.56726: 3063* 1/0/0 A 10.92.104.211 (66)
16:13:55.930112 IP 10.92.104.160.55139 > 10.92.103.53.53: 49621+ A? sdf-bill2myprint-lindo.node.consul. (52)
16:13:55.930135 IP 10.92.104.160.55139 > 10.92.103.53.53: 1195+ AAAA? sdf-bill2myprint-lindo.node.consul. (52)
16:13:55.930660 IP 10.92.103.53.53 > 10.92.104.160.55139: 1195* 0/0/0 (52)
16:13:55.930966 IP 10.92.103.53.53 > 10.92.104.160.55139: 49621* 1/0/0 A 10.92.104.209 (68)
16:13:56.228470 IP 10.92.104.160.40965 > 10.92.103.53.53: 63624+ A? sdf-bill2myprint-lindo.node.consul. (52)
16:13:56.228495 IP 10.92.104.160.40965 > 10.92.103.53.53: 5649+ AAAA? sdf-bill2myprint-lindo.node.consul. (52)
16:13:56.229083 IP 10.92.103.53.53 > 10.92.104.160.40965: 5649* 0/0/0 (52)
16:13:56.229370 IP 10.92.103.53.53 > 10.92.104.160.40965: 63624* 1/0/0 A 10.92.104.209 (68)
16:13:56.519258 IP 10.92.104.160.55260 > 10.92.103.53.53: 34456+ A? sdf-bill2myprint-lindo.node.consul. (52)
16:13:56.519278 IP 10.92.104.160.55260 > 10.92.103.53.53: 41265+ AAAA? sdf-bill2myprint-lindo.node.consul. (52)
16:13:56.519711 IP 10.92.103.53.53 > 10.92.104.160.55260: 41265* 0/0/0 (52)
16:13:56.519939 IP 10.92.103.53.53 > 10.92.104.160.55260: 34456* 1/0/0 A 10.92.104.209 (68)
16:13:56.805065 IP 10.92.104.160.60426 > 10.92.103.53.53: 5302+ A? sdf-bill2myprint-mysql-1.node.consul. (54)
16:13:56.805093 IP 10.92.104.160.60426 > 10.92.103.53.53: 1645+ AAAA? sdf-bill2myprint-mysql-1.node.consul. (54)
16:13:56.805823 IP 10.92.103.53.53 > 10.92.104.160.60426: 1645* 0/0/0 (54)
16:13:56.806105 IP 10.92.103.53.53 > 10.92.104.160.60426: 5302* 1/0/0 A 10.92.104.183 (70)
16:13:57.068737 IP 10.92.104.160.46281 > 10.92.103.53.53: 22221+ A? sdf-bill2myprint-mysql-1.node.consul. (54)
16:13:57.068766 IP 10.92.104.160.46281 > 10.92.103.53.53: 65175+ AAAA? sdf-bill2myprint-mysql-1.node.consul. (54)
16:13:57.079780 IP 10.92.103.53.53 > 10.92.104.160.46281: 65175* 0/0/0 (54)
16:13:57.080058 IP 10.92.103.53.53 > 10.92.104.160.46281: 22221* 1/0/0 A 10.92.104.183 (70)
16:13:57.306167 IP 10.92.104.160.60460 > 10.92.103.53.53: 52807+ A? sdf-bill2myprint-mysql-1.node.consul. (54)
16:13:57.306302 IP 10.92.104.160.60460 > 10.92.103.53.53: 14479+ AAAA? sdf-bill2myprint-mysql-1.node.consul. (54)
